#,npsn,nama_sekolah,alamat_sekolah,notelp_sekolah,kecamatan,agama,nama_kepala_sekolah,jam_sekolah,status_sekolah,keterangan_status_sekolah,users_id_users
0,20531862,SD Al Islam,Jl. Raya Tempurejo No.41,0878-5548-0518,Mulyorejo,Islam,H. Ahmad Zaini Ilyas,07.00-15.00,Tervalidasi,,1
1,20532823,SD YPPI-IV,Jl. Sutorejo Utara I No.2-6,null,Mulyorejo,All,Utari,07.00-14.00,Tervalidasi,,1
2,20533044,SD ISLAM AL AZHAR KELAPA GADING,Jl. Taman Bhaskara Utara No.1,(031) 5927420,Mulyorejo,Islam,Evi Nurhasanah,07.00-15.30,Tervalidasi,,1
3,20533144,SD Katolik Kristus Raja,Jl. Wisma Permai Tengah No.1,null,Mulyorejo,Katolik,Antonius Joko Purnomo,07.00-14.30,Tervalidasi,,1
4,20532815,SD VITA,Jl. Arief Rahman Hakim No. 189-191,(031) 594 7433,Kristen,Helenna Deborah,07.30-14.30,Tervalidasi,,1,
